{
  "short": "aioquic",
  "family": "aioquic",
  "aliases": [],
  "status": "observation_only",
  "identity": {
    "tp_id_set": [
      "0x1",
      "0x4",
      "0x5",
      "0x6",
      "0x7",
      "0x8",
      "0x9",
      "0xa",
      "0xb",
      "0xe",
      "0xf",
      "0x11"
    ],
    "tp_id_set_match": "set",
    "markers": {
      "has_0x11": true,
      "has_0x3128": false,
      "has_0x20": false,
      "has_0x2ab2": false
    },
    "scid_len": 8,
    "dcid_len": null,
    "datagram_count_class": 1,
    "ja4_hint": null
  },
  "emit": {
    "emit_kind": "match_only",
    "notes": "python aioquic"
  },
  "random": {
    "slots": [
      {
        "id": "initial_scid",
        "layer": "initial",
        "stable_for_identity": false,
        "policy": "library"
      }
    ]
  },
  "auth": {
    "capable": false,
    "channel": null,
    "demux_match": null,
    "requires_demux_fingerprint": false,
    "notes": "No stable auth overlay for this persona yet"
  },
  "observation_refs": [
    "aioquic"
  ],
  "notes": "No GREASE TP in this capture — auth channel absent.",
  "format": "quic-utls-profile-v1",
  "version": 1
}
