{
  "short": "uquic-chrome-115",
  "family": "uquic-chrome",
  "aliases": [
    "uquic115"
  ],
  "status": "experimental",
  "identity": {
    "tp_id_set": [
      "0x1",
      "0x3",
      "0x4",
      "0x5",
      "0x6",
      "0x7",
      "0x8",
      "0x9",
      "0xf",
      "GREASE",
      "0x20",
      "0x3128",
      "0x4752",
      "0xff73db"
    ],
    "tp_id_set_match": "set",
    "markers": {
      "has_0x11": false,
      "has_0x3128": true,
      "has_0x20": true,
      "has_0x2ab2": false
    },
    "scid_len": 0,
    "dcid_len": null,
    "datagram_count_class": 1,
    "ja4_hint": null
  },
  "emit": {
    "emit_kind": "uquic_preset",
    "uquic_preset": "chrome-115",
    "structured": {
      "transport_parameters": {
        "id_order": [
          "0x1",
          "0x3",
          "0x4",
          "0x5",
          "0x6",
          "0x7",
          "0x8",
          "0x9",
          "0xf",
          "GREASE",
          "0x20",
          "0x3128",
          "0x4752",
          "0xff73db"
        ],
        "grease": {
          "policy": "random_0_15"
        },
        "value_policy": "unspecified"
      },
      "client_hello": {
        "policy": "unspecified",
        "notes": "No ML-KEM era; not product chrome"
      }
    }
  },
  "random": {
    "slots": [
      {
        "id": "tp_grease_value",
        "layer": "transport_parameters",
        "stable_for_identity": false,
        "policy": "uquic"
      }
    ]
  },
  "auth": {
    "capable": false,
    "channel": null,
    "demux_match": null,
    "requires_demux_fingerprint": false,
    "notes": "No stable auth overlay for this persona yet"
  },
  "observation_refs": [
    "uquic115"
  ],
  "notes": "Stale vs live Chrome / sagernet parrot.",
  "format": "quic-utls-profile-v1",
  "version": 1
}
