{
  "short": "yandex",
  "family": "yandex",
  "aliases": [
    "winyandex"
  ],
  "status": "observation_only",
  "identity": {
    "tp_id_set": [
      "0x1",
      "0x3",
      "0x4",
      "0x5",
      "0x6",
      "0x7",
      "0x8",
      "0x9",
      "0xf",
      "0x11",
      "GREASE",
      "0x20"
    ],
    "tp_id_set_match": "set",
    "markers": {
      "has_0x11": true,
      "has_0x3128": false,
      "has_0x20": true,
      "has_0x2ab2": false
    },
    "scid_len": 0,
    "dcid_len": null,
    "datagram_count_class": 2,
    "ja4_hint": null
  },
  "emit": {
    "emit_kind": "match_only",
    "engine": {
      "chrome_parrot": false,
      "enable_datagrams": true,
      "zero_length_scid": true
    },
    "structured": {
      "initial": {
        "src_conn_id_length": 0,
        "frame_policy": "unspecified"
      },
      "transport_parameters": {
        "id_order": [
          "0x1",
          "0x3",
          "0x4",
          "0x5",
          "0x6",
          "0x7",
          "0x8",
          "0x9",
          "0xf",
          "0x11",
          "GREASE",
          "0x20"
        ],
        "grease": {
          "policy": "random_0_15"
        },
        "value_policy": "unspecified",
        "values": {
          "0x3128": {
            "kind": "omit"
          }
        }
      },
      "client_hello": {
        "policy": "unspecified",
        "alpn": [
          "h3"
        ]
      }
    }
  },
  "random": {
    "slots": [
      {
        "id": "tp_grease_value",
        "layer": "transport_parameters",
        "stable_for_identity": false,
        "policy": "unknown",
        "auth_overlay": false
      },
      {
        "id": "initial_dcid",
        "layer": "initial",
        "stable_for_identity": false,
        "policy": "random_bytes"
      }
    ]
  },
  "auth": {
    "capable": false,
    "channel": "tp_grease_value",
    "crypto": "demux-quic-v1",
    "value_len_min": 8,
    "value_len_max": 15,
    "emit_hook": null,
    "demux_match": {
      "quic": {
        "auth": true
      }
    },
    "requires_demux_fingerprint": false,
    "requires_emit_style": null,
    "notes": "Has RFC GREASE slot; demux verify is fingerprint-agnostic. Emit overlay not wired (would need non-parrot ChromeGREASEValue or structured apply)."
  },
  "observation_refs": [
    "yandex",
    "winyandex"
  ],
  "notes": "≠ chrome (no 0x3128). Auth only after structured emit.",
  "format": "quic-utls-profile-v1",
  "version": 1
}
